file,artist,title,year,lyrics,mood
TRBBXSE128F42798F6.h5,Mariah Carey,Honey,1997,"Oh oh
Honey got me hooked on you
I like that
Aaa aaa, aaa, aaa
(C'mon)
(M C)
Aaa, aaa, aaa
Nah nah nah ta ta nah
  (C'mon)
(Yea)
Ta nah nah, na na nah ta nah
Nah nah nah na
(MC)
Nah nah nah ta nah
Da ta na, nah nah nah, ta ta nah
(I like that)
Na na na da, da,da
(Let's go)

Oh honey, you can have me when you want me
Yea
You simply ask me to be there
(Aha)
And you're the only one who makes me come running
'Cause what you got is far beyond compare, ohh

And its just like honey
  (Yea)
When your love comes over me
  (When your love, comes over me)
(That's right)
Oh baby, I've got a dependancy
  (I've got)
Always strung out for another taste of your honey

It's like honey really washes over me
You know sugar never ever was so sweet
And I'm dyin' for ya, cryin' for ya, I adore ya
  (Cryin' hoo)
One hit of your love addicted me
  (Yeah)
Now I'm strung out on you darlin'
Don't you see every night and day
I can't hardly wait for another taste of honey

Honey can't describe
  (Woh)
How good it feels inside?
  (Haa)
  (Honey)
Honey can't describe
  (Yea)
How good it feels inside?

Yea yea ohh oh
I can't be elusive with you honey
(I like that)
'Cause it's blatant that I've feeling you
(Yea)
It's too hard for me to leave abruptly
You're the only thing I wanna do

And it's just like honey
When your love comes over me
  (When your love comes over me)
Oh baby, I've got a dependancy
  (Someday yea)
Always strung out for another
Taste of your honey
 (Ohh yea)

It's like honey really washes over me
You know sugar never ever was so sweet
  (Aaa)
And I'm dyin' for ya, cryin' for ya, I adore ya
  (Aaa)
One hit of your love addicted me
   (I need you bad)
  (Oh your love addicted me)
Now I'm strung out on you darlin'
Don't you see every night and day
  (I can't wait, for your love)
I can't hardly wait for another taste of honey


(Baby I can't all the way)
Harlem world we won't stop for Mariah, you're on fire
  (Honey I can't describe
  (How good it feels inside)
  (Got the help from all the saints)
Harlem world we won't stop, so Mariah, take us higher
  (Honey I can't describe)
  (How good it feels inside)
Harlem world we won't stop, for Mariah, you're on fire
  (Honey I can't describe, come speak to me)
Harlem world we won't stop, so Mariah, take us higher
Break it down

  (Whoa whoa, yeah)
(Every little thing you do)
Now, what we gonna do right here?
Is we gonna smooth it out?
(Hoo)
C'mon
(Ohh ohh)
  (Honey got me hooked on you)
(Aaa)
MC
(Ha ha ha)
And she won't stop

 (Honey)
It's like honey really washes over me
  (It's like)
You know sugar never ever was so sweet
  (Need your love)
And I'm dyin' for ya, cryin' for ya, I adore ya
  (I need your love, right now baby)
One hit of your love addicted me
  (Ohh)
Now I'm strung out on you darlin'
  (Ohh)
Don't you see every night and day
 (Need)
I can't hardly wait for another taste of honey
  (I need a taste of honey)

It's like honey really washes over me
  (Yeah)
  (I need)
You know sugar never ever was so sweet
And I'm dyin' for ya, cryin' for ya, I adore ya
  (Honey I)
  (Mc)
Honey
One hit of your love addicted me
  (Oh bad)
Now I'm strung out on you darlin'
Don't you see every night and day
  (Cute)
I can't hardly wait for another taste of honey
 (Honey I)
 (P V)
 (Honey I)
 (P V)

It's like honey really washes over me
  (Rock on)
  (I nee eee eed it, nee eee eed it)
You know sugar never ever was so sweet
  (That's right)
  (I nee eee eed it, nee eee eed it, babe)
And I'm dyin' for ya, cryin' for ya, I adore ya
  (Honey I)
One hit of your love addicted me
  (I nee eee eed it, nee eee eed it, babe)
Now I'm strung out on you darlin'
Don't you see every night and day
  (I nee eee eed it, nee eee eed it, babe)
I can't hardly wait for another taste of honey
  (I nee eee eed it, nee eee eed it, babe)",happy
TRAETTV12903CBBD09.h5,Jimi Hendrix,Voodoo Chile Blues,1994,"Jimi Hendrix
Miscellaneous
Voodoo Chile Blues

I'm a voodoo chile, lord I'm a voodoo chile.
Yeah.
The night I was born, lord the moon stood a fire red.
Said the night I was born, the moon turned a fire red.
My poor mother her cryin', she said ""The gypsy was right!""
And she fell right dead.

Hey, and he said ""Fly on, fly on!"", 'cause I'm a voodoo chile, baby
voodoo chile.",sad
TRAIAMS128EF34DC1B.h5,Y&T,Black Tiger,1982,"Cat eyes, she draws you in
Hypnotized, she's under your skin
Beauty to see, but not to touch
In the play of passion
She plays to rough

Black tiger, ready to strike
Searchin' for a victim
In the heat of the night

Cool and collected
She makes no mistakes
If you're in her territory
You know you're fair game
Scratch and claw all over your face
She's playing for keeps, oh no
You better get away

Black tiger, ready to strike
Searchin' for a victim
In the heat of the night

Black tiger, ready to strike
Searchin' for a victim
In the heat of the night
Black tiger, don't turn your back
You never know when she will attack
Hold out, watch out
Just stay away
She's gonna hurt you
Then leave you to waste
Watch out, jump back
Her teeth are sharp
If she gets too close
She's gonna make a mess of your heart

Black tiger, ready to strike
Searchin' for a victim
In the heat of the night",happy
TRBHEBY128F148CF2B.h5,Sister Hazel,Concede,1997,"Concede and believe me
I won't give up, I won't give out on you
Concede and believe me
I won't give up, I won't give out on you
Oh no, no, no, la la la la la, you, oh no

Now hear I promise to listen
Why won't you go for that?
Hear I promise to hold you
Why won't you go for that?

If I had wings and I could fly
Well I'd still walk with you
If I had a safe place to lie
I'd want to lay with you

Concede and believe me
I won't give up, I won't give out on you
Concede and believe me
I won't give up, I won't give out on you
Oh no, no, no, la la la la la, you, oh no

So now you shut off and you shut down
Won't let nobody in
When you shut off and you shut down
Won't play that fool again

I've seen your inside, you stay inside
And I won't go for that
I've seen your quarters
Seen your crooked sacred pictures on the wall

Concede and believe me
I won't give up, I won't give out on you
Concede and believe me
I won't give up, I won't give out on you
Oh no, no, no, la la la la la, you, oh no

I'll be your jester, be your fool
Compromising fool
I'll be your jester, be your fool

Concede and believe me
I won't give up, I won't give out on you
Concede and believe me
I won't give up, I won't give out",sad
TRAKAGL128F148B3B7.h5,Tesla,Gettin' Better,1986,"All that rain outside my window, it goes on and on, I know
It's gettin' better every day
Soon the sun will shine through my window, when it's gonna come
No I really couldn't say
Oh but I know, it's gettin' better every day

Oh, it's gettin' better now, every day, yeah yeah yeah yeah

I'm a hard workin' man, doin' all that I can, tryin' to make ends meet
Just a-makin' my way through this jungle today, it's gettin' the best of me

But I know it's gettin' better, and a change is gonna come my way
Yes I know it's gettin' better, better every day, oho yeah

Been a-changin' the scene, if you know what I mean
Good things are comin' my way
Now I'm livin' my life, and I'm doin' it right, sun shinin' every day

I can feel it gettin' better, and a change is gonna come my way
Yes I feel it gettin' better, better every day, yeah yeah

(Solo)

Now it's only gettin' better, and a change has finally come my way
Yes it's only so much better, oh, gettin' better every day, yeah
Oh yeah yeah yeah

Gettin' better, oh every day, I feel it
Gettin' better, it's gettin' better, I'm gettin' better
I'm gettin' better",happy
TRAFMDA128F4224347.h5,Sleepy John Estes,Street Car Blues,1930,"Street Car Blues Trk 10 3: 04
Sleepy John Estes
(John Adam Estes)
Sleepy John Estes - vocal &amp; guitar
Yank - mandolin, Jab Jones - piano
Recorded: May 13, 1930 Memphis, Victor # 59919-2
Album: Gus Cannon And His Jug Stompers - 2 CD set
'Legendenary 1928 - 1930 Recordings'
JSP Records CD3406


Now, I know the people
Is 'onna wonder, ev'rywhere
I say, I know the people
Is 'onna wonder, ev'rywhere
Because they heard of poor John
Was saw around 'lectric car

Now, catch the Central car for


Ride it down to Central Street
I say, I catch the Central car for
Ride it down to Central Street
Lord, I'm 'onna ease it down in Rovers
Catch my baby out on a midnight train

Lord, reason why baby, I
I been so long writin' to you
I said the reason why, baby
I been so long writin' to you
Because I been studyin' so hard
Lord, how to all sing these blues

'Sing 'em boy, for Mr. James!'

Lord, I lost my papa and my dear mama, too
I say, I love my papa and my dear mama, too
Lord, I'm gonna quit my bad way of livin'
And visit the Sunday school.

~",sad
TRBCIRO128F42B0277.h5,Christina Aguilera,Beautiful,2002,"Don't look at me

Every day is so wonderful
And suddenly it's hard to breathe
Now and then I get insecure
From all the pain, feel so ashamed

I am beautiful no matter what they say
Words can't bring me down
I am beautiful in every single way
Yes, words can't bring me down, oh no
So don't you bring me down today

To all your friends you're delirious
So consumed in all your doom
Tryin' hard to fill the emptiness, the piece is gone
Left the puzzle undone, ain't that the way it is?

'Cause you are beautiful no matter what they say
Words can't bring you down, oh no
You are beautiful in every single way
Yes, words can't bring you down, oh no
So don't you bring me down today

No matter what we do
No matter what we do
(No matter what we say)
No matter what we say
(We're the song that's outta tune)
(Full of beautiful mistakes)

(And everywhere we go)
And everywhere we go
(The sun will always shine)
The sun will always, always shine!
  (But tomorrow we might awake on the other side)

'Cause we are beautiful no matter what they say
Yes, words won't bring us down, oh no
We are beautiful in every single way
Yes, words can't bring us down, oh no
So don't you bring me down today

Don't you bring me down today
Don't you bring me down today",happy
TRABBXU128F92FEF48.h5,Mitch Ryder,Jenny Take a Ride,2004,"Hey!
Oh see, see see rider
Oh see, what you have done now
Oh see, see see rider
I said see, what you have done now
Ahh you made me love you
Now, now, now your man has gone

Oh, I'm going with my baby
And I won't be back til fall yeah
Oh, I'm going with my baby
And I won't be back til fall yeah
And if I find me a new girl,
I won't be back at all

Ah Jenny Jenny Jenny
Won't you come along with me
(Jenny Jenny whoo Jenny Jenny)
Jenny Jenny Jenny
Won't you come along with me
(Jenny Jenny whoo Jenny Jenny)
I worry bout you baby (spendin nights in misery)

Spinnin', spinnin' spinnin'
Spinnin' like a spinnin' top
(Jenny Jenny whoo Jenny Jenny)
Spinnin', spinnin' spinnin'
Spinnin' like a spinnin' top
(Jenny Jenny whoo Jenny Jenny)
Come along baby (feelin' love)

Whoo

Yeah see, see see rider
Oh see, what you have done now
Oh see, see see rider
Ah come on see, what you have done now
Ahh You made me love you
Now, now, now, now your man has gone

Ah Jenny Jenny Jenny
Won't you come along with me
(Jenny Jenny whoo Jenny Jenny)
Jenny Jenny Jenny
Won't you come along with me
(Jenny Jenny whoo Jenny Jenny)
Come along girl

Spin spin spinnin like a spinnin top
(Jenny Jenny whoo Jenny Jenny)
Spin spin spinnin like a spinnin top
(Jenny Jenny whoo Jenny Jenny)",happy
TRAVXII128F92FCC6D.h5,Stephen Marley,Mind Control,2005,"Yeah, yeah, yeah
Now tell you what

It's mind control, mind control
Corruption of your thoughts (yeah), destruction of your soul
Mind control, it's mind control
Corruption of your thoughts (yeah), destruction of your soul

Don't let them mould your mind, they want to control mankind
Seems like their only intention is to exploit the earth (hey)
And you trust in their deceit, your mind causes your defeat
And so you become an invention to distort this earth

Propaganda and lies, is a plague in our lives
How much more victimised, before we realise (hey)

It's mind control, mind control
Corruption of your thoughts (yeah), destruction of your soul
Mind control, it's mind control
Corruption of your thoughts (yeah), destruction of your soul

Ooh grand master, let the people go
You put them in total confusion, to downs-troy their soul
For they practise what you preach, so they're always in your reach
High-tech slavery in these days, it's mind control

They'll make it attractive, to get man distracted
corrupting your, polluting your
destroying (your soul, mind control)
Mind control
Corruption of your thoughts (yeah), destruction of your soul
Mind control, it's mind control
Corruption of your thoughts (yeah), destruction of your soul

Come on and, get it together brother man
What, what you say?
Yeah

It's mind control, mind control
Corruption of your thoughts (yeah), destruction of your soul
Mind control, it's mind control
Corruption of your thoughts (yeah), destruction of your soul

(the truth is there for us to see)
It's mind control, mind control
Corruption of your thoughts (yeah), destruction of your soul
(the truth is there for us to see)
Mind control, it's mind control
Corruption of your thoughts (yeah), destruction of your soul

(the truth is there for us to see)
(the truth is there for us to see)
(the truth is there for us to see)",sad
TRASNRV128F931AE2E.h5,Nine Inch Nails,Sin,1989,"You give me the reason
You give me control
I gave you my purity
My purity you stole

Did you think I wouldn't recognize this compromise?
Am I just too stupid to realize?
Stale incense, old sweat and lies, lies, lies

It comes down to this
Your kiss, your fist
And your strain, it gets under my skin
Within, take in, the extent of my sin

You give me the anger
You give me the nerve
Carry out my sentence
Well, I get what I deserve

I'm just an effigy, to be defaced, to be disgraced
But your need for me has been replaced
And if I can't have everything, well then just give me a taste

It comes down to this
Your kiss, your fist
And your strain, it gets under my skin
Within, take in, the extent of my sin

You give me the reason
You give me control
I gave you my purity
My purity you stole

Did you think I wouldn't recognize this compromise?
Am I just too stupid to realize?
Stale incense, old sweat and lies, lies, lies

It comes down to this
Your kiss, your fist
And your strain, it gets under my skin
Within, take in, for my sin

It comes down to this
Your kiss, your fist
And your strain, it comes under my skin
Within, take in, the extent of my sin
Woh!",sad
TRAYBTO128F932008B.h5,Jesse Malin,Since You're In Love,2004,"When the rain comes down
Ni this northern town
It was a banner year
In the world of fear
I though Id drop you a line

When you comb your hair
And youre unaware
And your friends all say that youre looking great
Those black and white movies apply

Since youre in love
Im still said over you

Gonna sleep away
All my sunny days
And in another year well I wont be here
Hoping that youll change your mind
Since youre in love
Im still sad over you",sad
TRAZASM128F932FBEE.h5,Franz Ferdinand,Do You Want To,2005,"Oh well I woke up tonight and said I
I'm gonna make somebody love me
I'm gonna make somebody love me
And now I know, now I know, now I know
I know that it's you
You're lucky, lucky, you're so lucky!

Well do ya, do ya, do ya wanna?
Well do ya, do ya, do ya wanna?
Wanna go, where I've never let you before?

Well do ya, do ya, do ya wanna?
Well do ya, do ya, do ya wanna?
Wanna go, of what I've never let you before?

Well he's a friend and he's so proud of you
He's a friend and I knew him before you, oh yeah
Well he's a friend and we're so proud of you
Your famous friend, well I blew him before ya, oh yeah

Well do ya, do ya, do ya wanna?
Well do ya, do ya, do ya wanna?
Wanna go, where I've never let you before?

Well here we are at the transmission party
I love your friends they're all so arty, oh yeah

Well I woke up tonight and said I
I'm gonna make somebody love me
I'm gonna make somebody love me
And now I know, now I know, now I know
I know that it's you
You're lucky lucky, you're so lucky!

Well do ya, do ya, do ya wanna?
Well do ya, do ya, do ya wanna?
Wanna go, of what I've never let you before?
Lucky lucky, you're so lucky
Lucky lucky, you're so lucky
Lucky lucky, you're so lucky
Lucky lucky, you're so lucky
Lucky lucky, you're so lucky
Oh lucky lucky, you're so lucky
Yeah!",happy
TRAUVVR128F425A925.h5,Eurythmics,A Little Of You,1986,"There used to be a time
I wore my heart upon my sleeve
There used to be a time
I'd show my gentle side to anyone
Through these years of wandering
I know I've been deceived
Through these years of wandering

And every time you try to hurt me
You know you'll only hurt yourself
And every time you try to hurt me
I know you'll be the one to suffer
When you think you're hurting someone

A little of you, a little of me
A little of you is hurting someone
A little of you, a little of me
A little of you is hurting someone

A little of you, a little of me
A little of you is hurting someone
A little of you, a little of me
A little of you

Don't tell me I'm the only one 'cause I don't need that space
Don't ask for love, I'll throw it back in your face
All of these promises were only made to break
All of these promises

And every time you try to hurt me
You know you'll only hurt yourself
And every time you try to hurt me
I know you'll be the one to suffer
When you think you're hurting someone

A little of you, a little of me
A little of you is hurting someone
A little of you, a little of me
A little of you is hurting someone

A little of you, a little of me
A little of you is hurting someone
A little of you, a little of me
A little of you

A little of you, a little of me
A little of you is hurting someone
A little of you, a little of me
A little of you is hurting someone

A little of you, a little of me
A little of you is hurting someone
A little of you, a little of me
A little of you is hurting some one

A little of you a little of me
A little of you is hurting someone",sad
TRAFQFM128E078EC97.h5,Eminem,The Way I Am,2000,"Whatever, Dre, just let it run
Aiyyo, turn the beat up a little bit
Aiyyo, this song is for anyone, fuck it
Just shut up and listen, aiyyo

I sit back with this pack of Zig Zags and this bag
Of this weed it gives me the shit needed to be
The most meanest MC on this, on this Earth
And since birth I've been cursed with this curse to just curse

And just blurt this berserk and bizarre shit that works
And it sells and it helps in itself to relieve
All this tension dispensin' these sentences
Gettin' this stress that's been eatin' me recently off of this chest

And I rest again peacefully
(Peacefully)
But at least have the decency in you
To leave me alone when you freaks see me out
In the streets when I'm eatin' or feedin' my daughter
To not come and speak to me
(Speak to me)

I don't know you and no
I don't owe you a motherfuckin' thing
I'm not Mr. N'Sync, I'm not what your friends think
I'm not Mr. Friendly, I can be a prick
If you tempt me, my tank is on empty
(Is on empty)

No patience is in me and if you offend me
I'm liftin' you 10 feet in the air
(Liftin' you 10 feet)
I don't care who is there and who saw me destroy you

Go, call you a lawyer, file you a lawsuit
I'll smile in the courtroom and buy you a wardrobe
I'm tired of all you
(Of all you)
I don't mean to be mean
But that's all I can be is just me

And I am, whatever you say I am
If I wasn't then why would I say I am?
In the paper, the news everyday I am
Radio won't even play my jam

'Cause I am, whatever you say I am
If I wasn't, then why would I say I am?
In the paper, the news everyday I am
I don't know it's just the way I am

Sometimes I just feel like my father, I hate to be bothered
With all of this nonsense, it's constant
And, ""Oh, it's his lyrical content, the song
'Guilty Conscience' has gotten such rotten responses""

And all of this controversy circles me
And it seems like the media immediately
Points a finger at me
(Finger at me)
So I point one back at 'em but not the index or pinkie
Or the ring or the thumb, it's the one you put up

When you don't give a fuck, when you won't just put up
With the bullshit they pull 'cause they full of shit too
When a dude's gettin' bullied and shoots up his school
And they blame it on Marilyn and the heroin
(On Marilyn)

Where were the parents at? And look where it's at
Middle America, now, it's a tragedy
Now, it's so sad to see, an upper class city
Havin' this happenin'
(This happenin')

Then attack Eminem 'cause I rap this way
(Rap this way)
But I'm glad 'cause they feed me the fuel that I need for the fire
To burn and it's burnin' and I have returned

And I am, whatever you say I am
If I wasn't then why would I say I am?
In the paper, the news everyday I am
Radio won't even play my jam

'Cause I am, whatever you say I am
If I wasn't, then why would I say I am?
In the paper, the news everyday I am
I don't know it's just the way I am

I'm so sick and tired of bein' admired
That I wish that I would just die or get fired
And dropped from my label and stop with the fables
I'm not gonna be able to top on ""My Name is""

And pigeon holed into some poppy sensation
To cop me rotation at rock 'n' roll stations
And I just do not got the patience
(Got the patience)
To deal with these cocky Caucasians who think
I'm some wigger who just tries to be black 'cause I talk

With an accent and grab on my balls so they always keep askin'
The same fuckin' questions
(Fuckin' questions)
What school did I go to, what hood I grew up in?

The why, the who what when, the where and the how
'Til I'm grabbin' my hair and I'm tearin' it out
'Cause they drivin' me crazy, I can't take it
(Drivin' me crazy)
I'm racin', I'm pacin', I stand and I sit

And I'm thankful for every fan that I get
But I can't take a shit in the bathroom
Without someone standin' by it
No, I won't sign your autograph
You can call me an asshole I'm glad

'Cause I am, whatever you say I am
If I wasn't then why would I say I am?
In the paper, the news everyday I am
Radio won't even play my jam

'Cause I am, whatever you say I am
If I wasn't, then why would I say I am?
In the paper, the news everyday I am
I don't know it's just the way I am",sad
