file,artist,title,year,lyrics,mood
TRBGWVI128E0788AE7.h5,22-20s,Hold On,2004,"Strangers in my backyard
Selling you beliefs
Danger in my empire
Trouble on the streets

And I don't want to modernize
And I don't want to rearrange
I don't want to fix up
And I don't want to change

Hold on
To the things that you love
Hold on
To the things that you love
Hold on

Danger in the papers
Danger in the magazines
Sell you ideas
Sell you false dreams

And I don't want to modernize
And I don't want to rearrange
I don't want to fix up
And I don't want to change

Hold on
To the things you can feel
Hold on
To the things that are real
Hold on

Strangers in my backyard
Selling you beliefs
Danger in my empire
Trouble on the streets

And I don't want to modernize
And I don't want to change
I don't want to fix up
I don't want to rearrange

Hold on
To the things you feel
Hold on
To the things that are real

Hold on
To the things that you love
Hold on
To the things that you love

Hold on
To the things you believe
Hold on
To the things that you see

Hold on
To the one that you love
Hold on
To the one that you love",sad
TRALQZK128F429802D.h5,Kings Of Leon,Day Old Blues,2004,"Toss me a breath when you hold me down
Hot like a razor on my face
Somethings growing that don't help me now
Paging the doctor just in case

Low and behold things are killing me
Silly expectation of a dream
Girls are gonna love the way I toss my hair
Boys are gonna hate the way I seem

Day old, day old, day old
Day old, day old, day old
Day old, day old, day old blues
Day old, day old, day old
Day old, day old, day old
Day old, day old, day old blues

Day old, day old, day old
Day old, day old, day old
Day old, day old, day old blues
Day old, day old, day old
Day old, day old, day old

Peach Christmas lights spitting German ling
Feels like a fast or homeless sleep
At least there's a record that I love to play
Dreaming about a place I'll never see

Day old, day old, day old
Day old, day old, day old
Day old, day old, day old blues
Day old, day old, day old
Day old, day old, day old
Day old, day old, day old blues

Day old, day old, day old
Day old, day old, day old
Day old, day old, day old blues
Day old, day old, day old
Day old, day old, day old
Day old, day old, day old blues

Betty, Betty, Annie is a praying
Baby with a man like a lung
Smell her crying fighting back a fever
Mad as hell give up

Day old, day old, day old
Day old, day old, day old
Day old, day old, day old blues
Day old, day old, day old
Day old, day old, day old
Day old, day old, day old blues
Day old, day old, day old
Day old, day old, day old
Day old, day old, day old blues
...",sad
TRAXWLM128F1453E3B.h5,Juelz Santana,There It Go (The Whistle Song),2005,"Santana
(Ay)
It's Dipset

There it go
Baby don't stop now
There it go
Baby don't stop now

[Whistling]
There it go
Damn shorty look good
And I'm thinkin' ~bout gettin' at her
Okay, time to whistle at her
Ay girl you make my whistle blow

There it go
Bring it here baby
There it go
Bring it here baby

Top down and I'm at it again
It's hot now and I'm at it to win
You heard me

Who want it with me?
Nobody want it with me
Oh I'm so fly
Oh Mami come ~n get me

Sit it down
Back up
Bring it on back up
Move it ~til you feel something hard in your back up

There it go
If you want it, come and get it
I aint kiddin', I'm wit it
Here it go, go

[Whistling]
So girl let me see you get low
There it go, yeah jus' like that
Move your thang like a boomerang
And come right back

There it go
I don't need to ask I proceed to grab
A chick suck my G'd up swagger
There it go

[Whistling]
There it go
Damn shorty look good
And I'm thinkin' bout gettin' at her
Okay, time to whistle at her
[Whistling]
Ay girl you make my whistle blow

There it go
Bring it here baby
(C'mon)
There it go
Bring it here baby
(C'mon)

[Whistling]
Ay girl let me see you get low
There it go
Set it down baby
There it go
Set it down baby

(Ohh)
There it go, it's Dipset
(Ohh)
There it go, ay ay ay
There it go, it's Dipset
(Ohh)
There it go, ay ay

I got to get it, I'm so hot terrific
So not fair to the other guys that's in it
I know not a limit ~cause no sky's the limit
~Til then I'm doin' my, doin' my, doin' my thang
So baby keep moving your, moving your, moving your thang
And that'll keep you in the, you in the, you in the ring
Or maybe not

[Whistling]
Ay girl you make me want to know

You do it like a pro ~lil lady
If so, bring it here let it show ~lil lady
There it go
Let's go ~lil lady to the crib, to the tele
You know ~lil lady

Run
Yes girl
Uhm yes we can have a
Cum-fest girl ~til the sun sets girl
(Girl)
[Whistling]
But first I gotta get you undressed girl
So take off dem clothes and undress girl

Damn shorty look good
And I'm thinkin' ~bout gettin' at her
Okay, time to whistle at her
[Whistling]
Ay girl you make my whistle blow

There it go
Bring it here baby
(C'mon)
There it go
Bring it here baby
(C'mon)

[Whistling]
Ay girl let me see you get low
There it go
Set it down baby
There it go
Set it down baby

[Whistling]",happy
TRAGVTG128F92FE9E2.h5,Jerry Butler,He Will Break Your Heart,1960,"Desmond has his barrow in the market place...
Molly is the singer in a band...
Desmond says to Molly ""Girl, I like your face""
And Molly says this as she takes him by the hand...
Ob-la-di, ob-la-da, life goes on, brah!...
Lala how the life goes on...
Ob-la-di, ob-la-da, life goes on, brah!...
Lala how the life goes on.

Desmond takes a trolley to the jewelry store...
Buys a twenty carat golden ring...
Takes it back to Molly waiting at the door...
And as he gives it to her she begins to sing...
Ob-la-di, ob-la-da, life goes on, brah!...
Lala how the life goes on...
Ob-la-di, ob-la-da, life goes on, brah!...
Lala how the life goes on.

In a couple of years they have built a home sweet home,
With a couple of kids running in the yard,
Of Desmond and Molly Jones... (Ha ha ha ha ha)

Happy ever after in the market place...
Desmond lets the children lend a hand...
Molly stays at home and does her pretty face...
And in the evening she still sings it with the band...
Ob-la-di, ob-la-da, life goes on, brah!...
Lala how the life goes on...
Ob-la-di, ob-la-da, life goes on, brah!...
Lala how the life goes on.

In a couple of years they have built a home sweet home,
With a couple of kids running in the yard,
Of Desmond and Molly Jones...
Happy ever after in the market place...
Molly lets the children lend a hand...
Desmond stays at home and does his pretty face...
And in the evening she's a singer with the band...
Ob-la-di, ob-la-da, life goes on, brah!...
Lala how the life goes on...
Ob-la-di, ob-la-da, life goes on, brah!...
Lala how the life goes on.

And if you want some fun... take Ob-la-di-bla-da (Thank you)",happy
TRAREHS128F92F8E13.h5,Snow Patrol,New Sensation,2009,"(INXS cover)

Live baby live
Now that the day is over
I got a new sensation
In perfect moments
Impossible to refuse

Sleep baby sleep
Now that the night is over
And the sun comes like a god
Into our room
All perfect light and promises

Gotta hold on you
A new sensation
A new sensation
Right now
Gonna take you over
A new sensation
A new sensation

Dream baby dream
Of all that's come and going
And you will find out
In the end
There really is
There really is no difference

Cry baby cry
When you've got to get it out
I'll be your shoulder
You can tell me all
Don't keep it in ya
Well that's the reason why I'm here

Are you ready for a new sensation
A new sensation
Right now
Gonna take you on a new sensation
A new sensation

Hate baby hate
When there's nothing left for you
You're only human
What can you do
It'll soon be over
Don't let your pain take over you

Love baby love
It's written all over your face
There's nothing better we could do
Than live forever
Well that's all we've got to do

Are you ready for a new sensation
A new sensation (x2)",sad
TRBHKXX128F4252D02.h5,Radiohead,Everything In Its Right Place,2000,"Here comes the flood
Here comes the flood
Here comes the flood
1, 2, 3

Everything
Everything
Everything
Everything
In its right place
In its right place
Right place
Right place

Yesterday I woke up sucking a lemon
Yesterday I woke up sucking a lemon
Yesterday I woke up sucking a lemon
Yesterday I woke up sucking a lemon

Everything
Everything
Everything
In its right place
In its right place
Right place
Right place

There are two colours in my head
There are two colours in my head
What, what is that you tried to say?
What, what was that you tried to say?
Tried to say
Tried to say
Tried to say
Tried to say

{There are two colours in my head
There are two colours in my head
There are two colours in my head}",sad
TRAVMWQ128F934B098.h5,Fever Ray,When I Grow Up,2009,"When I grow up
I want to be a forester
Run through the moss on high heels
That's what I'll do
Throwing out boomerang
Waiting for it to come back to me

When I grow up
I want to live near the sea
Crab claws and bottles of rum
That's what I'll have
Staring at the seashell
Waiting for it to embrace me

I put my soul in what I do
Last night I drew a funny man
With dark eyes and a hanging tongue
It goes way bad
I never liked a sad look
From someone who wants to be loved by you

I'm very good with plants
When my friends are away
They let me keep the soil moist
On the seventh day I rest
For a minute or two
Then back on my feet and cry for you

You've got cucumbers on your eyes
Too much time spent on nothing
Waiting for a moment to arise
The face in the ceiling
And arms too long
I wait for him to catch me

Waiting for you to embrace me",sad
TRBGHRA128F42B90E6.h5,The Cardigans,Explode,1998,"Ease your trouble, we'll pay them double
Not to look at you for a while
And you rely on what you get high on
And you last just as long as it serves you

Explode or implode, explode or implode
We will take care of it
Explode or implode, explode or implode
We will take care of it, yes we will carry you

'Cause you're deserted, what's good you hurt it
And kills you, it keeps you alive
So give it up in a world of puppets
It's a shame what they do to us all

Explode or implode, explode or implode
We will take care of it
Explode or implode, explode or implode
We will take care of it, yes we will carry you

Can we do anything for you now?

Explode or implode, explode or implode
We will take care of it
Explode or implode, explode or implode
We will take care of it, yes we will carry you",sad
TRAEQOS128F92EFD47.h5,The Fray,Vienna,2002,"This last one-way ticket train pulls in
We smile for the casual closure capturing.
There goes the downpour
Here goes my fare thee well

There's really no way to reach me
There's really no way to reach me
There's really no way to reach me
Cause I'm already gone

There's only so many words that we could say
Spoken upon long-distance melody.
This is my hello
This is my goodness

There's really no way to reach me
There's really no way to reach me
There's really no way to reach me
Cause I'm already gone

Maybe in five or ten yours and mine will meet again
Straighten this whole thing out.
Maybe then honesty need not be feared as a friend or an enemy
But this is the distance
And this is my gameface

There's really no way to reach me
There's really no way to reach me
Is there really no way to reach me
Am I already...
So this is your Maverick
And this is Vienna",sad
TRAYLRS128F427FE81.h5,Scar Symmetry,Abstracted,2006,"Darkness falls
Light descending
From the sky
And towards the ground

Electric presence
Prolonged strobe flash
Bays of light
Now shatters the night

Abstracted shape
Abstracted one
High voltage bolt was aimed
At the head and chest

One taken, lost to the skies
Gone, taken away
Five days absent

The manhunt fails
None can explain
The course of events

Abstracted shape
Abstracted one
High voltage bolt was aimed
At the head and chest

Abducted soul
Abducted mind
Bright bolts of energy slays reality

Abstracted shape
Abstracted one
High voltage bolt was aimed
At the head and chest

Abducted soul
Abducted mind
Bright bolts of energy slays reality

Departure
Strange sights
Chaos within me

Departure
Bright lights
I can't believe my eyes

Darkness falls
Light descending
From the sky
And towards the ground",sad
TRAYICR128F4282520.h5,Kyle Riabko,Doesn't Get Much Better,2005,"Today the sun is shining bright and so am I
'Cause the people who make my world go round
Are by my side hey Roger
Why don't you just lay it down?
I saw her you're making Kay dance around
While Tashia Bree is comin for me, yeah, yeah

So good, so fine
All these colours are a part of my life
So sweet is your kiss
No, it doesn't get much better than this

Brutus is screaming out of key, but no one cares
Electric Ladyland is flowing through the air
Hey Jody
(Jody John G on the bass guitar)
Ryan told me tonight's the night Jules' gonna break some hearts
Natashia Bree is comin' for me, yeah, yeah

So good
(So good)
So fine
When you rub a little Heaven on mine
(All mine)

So sweet
(Sweet)
Is your kiss
(Kiss)
No, it doesn't get much better than this
(No)
No, it doesn't get much better than this

Don't get no better, don't get no better
Don't get no, don't get no, don't get no
Don't get no better
Don't get no better, don't get no better
Don't get no better, don't, don't get no better, no

So good
(So good)
So fine
(So fine)
All these colours are a part of my life
(Part of my life)
So sweet is your kiss
No, it doesn't get much better than this
(No, no, no)
No, it doesn't get much better than this
No, it doesn't get much better than this",happy
TRBALVT128F145B6CB.h5,Billie Jo Spears,Misty Blue,1976,"Oh, it's been such a long, long time
Looks like I'd get you off my mind
Oh, but I can't, just the thought of you
Turns my whole world a misty blue

Just the mention of your name
Turns the flicker to a flame
I think of things we used to do
Then my whole world turns misty blue

I should forget you
Heaven knows I tried
But when I say, ""I'm glad we're through""
My heart knows I lied

Oh, it's been such a long, long time
Looks like I'd get you off my mind
Oh, but I can't, just the thought of you
Turns my whole world a misty blue
Oh, but I can't, just the thought of you
Turns my whole world a misty blue",sad
TRBHVLH128F92F2369.h5,Sandi Thom,When Horsepower Meant What It Said,2006,"Caught in the gridlock nose to tail across all lanes
Smog nearly chocking me as the car horns go insane
Patiently waiting to get their old jobs backs
Carrying the human race proudly on their backs

How easily forgotten,
How easily we're led
How hard the path is trodden
From when horsepower meant what it said

I've got a hundred horses hidden in between my wheels
But i can't put my foot down and jumped the fences in the field
Patiently waiting to get their old jobs back

How easily forgotten,
How easily we're led
How hard the path is trodden
From when horsepower meant what it said

And if we're keeping up with progress why am i standing still
Maybe we should take a walk and talk to the horses on the hill

How easily forgotten,
How easily we're led
How hard the path is trodden
From when horsepower meant what it said

How hard the path is trodden
From when horsepower meant what it said",happy
TRASRBB128F42AFD5C.h5,Brian Littrell,Wish,2006,"For just a moment, I wish I could have been there
To see Your first step, hear Your very first word
Tell me, did You ever fall and scrape Your knee?
Did You know Your wounds would one day heal the world?

For just one moment, I wish I could have seen You growing
Learning the ways of a carpenter's son
Just a little boy gazing at the stars
But You remember creating every one

If You passed by, would I have seen a child or a king?
Would I have known?

I wish I could have been there
My only wish is to see You face to face
Wish I could have been there
Just to see You, Jesus, face to face

For just a moment, I wish I could have been there
When You left Your footprints upon the waves
To walk along beside You and never look away
Just Your whisper and the wind and sea, obey

To see You feed the people
To feel Your healing in Your touch

I wish I could have been there
My only wish is to see You face to face
Wish I could have been there
Just to see You, Jesus, face to face

To hear You pray in the garden alone
Laying down Your will with each tear
To see You walk that lonely road
Willing to die for me

And in that moment
I know I should have been there
You took my cross and gave Your life
And You live again, and You live again

Wish I could have been there
My only wish is to see You rise again
Wish I could have been there
My only wish is to see You, Jesus, face to face

Someday I'll be there, I'm gonna be there
I'll see Your face, Your mercy, Your grace
Someday, someday
I'm gonna see You, Jesus, face to face",sad
TRAIZQI128F42A51F9.h5,Matisyahu,Refuge,2004,"Ani auni vevyone, hashem yashav li
Ezrati, umafalti, atau

Said if You have been a refuge for me
A tower of strength in the face of the enemy
Enemy, enemy

From the end of the earth unto you I call
Time and again I fall, back to you I crawl
You have been a refuge for me
Tower of strength in the face of the enemy

Enemy lines, enemy lines
Find I let myself get caught too many times, too many times, yeah
I gave you my heart, taking back what's mine
Yeah, you saved my soul from the other side, yeah, oh

From the end of the earth unto you I call
Time and again I fall, back to you I crawl
Said, if you have been a refuge for me
A tower of strength in the face of the enemy

Enemy, enemy, enemy, enemy
Enemy, enemy, enemy, enemy
Yeah, yeah, yeah, yeah, yeah

With you I smash a troop and with my God I leap over a wall
May the king answer you on the day that you call
Stand tall, battle yawl, from the clouds crawl low
Heavens lay draped over New York City like a prayer shawl
Holy one enthroned upon the praises of Israel",sad
TRADVGV128F42BCACE.h5,Avril Lavigne,Innocence,2007,"Waking up I see that everything is okay
The first time in my life and now it's so great
Slowing down I look around and I am so amazed
I think about the little things that make life great
I wouldn't change a thing about it
This is the best feeling
This innocence is brilliant, I hope that it will stay
This moment is perfect, please don't go away, I need you now

And I'll hold on to it, don't you let it pass you by
I found a place so safe, not a single tear
The first time in my life and now it's so clear
Feel calm I belong, I'm so happy here
It's so strong and now I let myself be sincere

I wouldn't change a thing about it
This is the best feeling
This innocence is brilliant, I hope that it will stay
This moment is perfect, please don't go away, I need you now
And I'll hold on to it, don't you let it pass you by
It's the state of bliss you think you're dreaming

It's the happiness inside that you're feeling
It's so beautiful it makes you wanna cry
It's the state of bliss you think you're dreaming
It's the happiness inside that you're feeling
It's so beautiful it makes you wanna cry
It's so beautiful it makes you wanna cry
This innocence is brilliant
It makes you want to cry

This innocence is brilliant

Please don't go away
'Cause I need you now and I'll hold on to it
Don't you let it pass you by
This innocence is brilliant, I hope that it will stay
This moment is perfect, please don't go away, I need you now
And I'll hold on to it, don't you let it pass you by",happy
TRAABJV128F1460C49.h5,Lionel Richie,Tonight Will Be Alright,1986,"Little darling
Where you've been so long
I've been out here thinking about ya
And the feeling's real strong
Well the time has come to celebrate
You and me girl so sounds great
Cause tonight will be alright
Oh baby

Little darling, come on
Let's take a ride
To a midnight honey town and set it on fire
We don't want to be mad
But we have to be cool
You and me girl
Let's break all the rules
Cause tonight will be alright
Oh my baby, I'm gonna say it again

I can see us moving on
Down the highway
I can see us loving
Till our hearts desire
Anything you wanna do girl
You just tell me
Cause it's alright, cause it's alright

Little darling, telling you no use
Keep me thinking about you honey
My soul's on fire
Well if you want me girl
And the games I play
Anything's alright, anything you say
Cause tonight will be alright
Alright, baby I'll say it again, alright
Alright, alright, alright, baby
We gonna make it alright
You and me baby, alright",happy
TRAFBVU128F426B3F6.h5,Dimmu Borgir,The Fundamental Alienation,2007,"My eyes got blinded
And conned by the light
Like a fugitive on the run
I sought perseverance in the night

Deceptive icons were finally
Taken out of my sight
As the contender to origin
I will forever unveil His might

They say I am the cancer
On the back of the Inquisition
I may well be the cancer
In the heart of the Inquisition

They say I am the cancer
On the back of the Inquisition
I am the cancer
In the heart of the Inquisition

Through my years of sacrifice
Evolution came with lessons learned
Respect and fear
Is what I earned

So underestimate not your vision
Or you will be taught
Calculate your intuition
And you will teach

You all have been conned
And I always take the blame
For you do not understand
You are all the same

They say I am the cancer
On the back of the Inquisition
I may well be the cancer
In the heart of the Inquisition

They say I am the cancer
On the back of the Inquisition
I may well be the cancer
In the heart of the Inquisition

They say I am the cancer
On the back of the Inquisition
I am the cancer
In the heart of the Inquisition

My eyes got blinded
And conned by the light
Like a fugitive on the run
I sought perseverance in the night",sad
TRAZVYP128F1459AD9.h5,Leona Naess,Star Signs,2003,"And I still love him tonight
No distance or time can bite
And I still feel out of place
In crowded rooms and the silence of space

No love could be this hard to beat
I still read your star signs, star signs

And they know just when to hit
When morning comes and your friends, they gotta split
And you know just what to say
When no one's around you know how to play

No love could be this hard to beat
I still read your star signs, star signs

Baby, baby can't you see
This world ain't big enough for you or me
So light the candles and turn out your lights
And turn on my lights

No love could be this hard to beat
I still read your star signs, star signs

I don't even know what they mean
What you mean
I don't even know what you mean
What you mean",sad
